Category,Name,Price,Brand,Description,Product_Info
햄스터 사료,햄토피아 몸에 좋고 맛도 햄찌밥 햄스터사료,2200,,,Mall: 네이버
햄스터 사료,PSP 햄스터 건강혼합사료 햄스터 사료 먹이 밥,2600,,,Mall: 햄찌네 햄스터
햄스터 사료,[패러그린] 프리미엄 드워프햄스터 사료 580g(완품) 햄스터밥 먹이,14000,패러그린,,Mall: 햄토피아
햄스터 사료,[패러그린] 프리미엄 골든햄스터 사료 550g(완품),14000,패러그린,,Mall: 햄토피아
햄스터 사료,피그미다람쥐 사료 먹이 간식 밀프로던트 850g 건조밀웜 건조당근,20000,,,Mall: 신비한동물원
햄스터 사료,"슈가야미 소프트 펠렛 400g / 슈가글라이더 사료,주사료,먹이",14500,,,Mall: 미니스토리펫
햄스터 사료,골든 햄스터 사료 먹이 PSP건강혼합사료 600g,1600,,,Mall: 펫하우스
햄스터 사료,[JR팜] 햄스터 피스트 80g / 맛있는 먹이 사료 밥 hamster feed,1400,,,Mall: 햄토피아
햄스터 사료,[HASSY] 해씨 햄스터가든 골든용 500g (완품) / 건강한 사료 먹이,15500,,,Mall: 햄토피아
햄스터 사료,할란 익스트루전 (70g 소분) / ENVIGO 햄스터 이갈이 간식 사료,900,,,Mall: 모모팜스토어
햄스터 사료,PSP 해피세트 익스트루젼 270g 햄스터 사료 먹이 밥,2500,,,Mall: 햄찌네 햄스터
햄스터 사료,샘타코 익스트루전 햄스터사료 500g,3500,,,Mall: 햄스터몰
햄스터 사료,리얼크라운 햄스터사료 600g ( 다람쥐 밥 먹이 해바라기씨 간식 이갈이 모음),1750,,,Mall: 벅스앤미
햄스터 사료,패러그린 프리미엄 드워프햄스터사료 세척혼합 580g,12210,패러그린,,Mall: 네이버
햄스터 사료,햄토피아 네이쳐 테이스트 골든 햄스터사료600g,2500,,,Mall: 네이버
햄스터 사료,스몰펫용품 스위트 햄스터 사료 1팩 700g,2260,,,Mall: 네이버
햄스터 사료,햄토피아 네이쳐 테이스트 드워프 햄스터사료600g,2500,,,Mall: 네이버
햄스터 사료,퓨리나 익스트루젼 햄스터 이갈이 사료,800,퓨리나,,Mall: 햄블리 HAMVELY
햄스터 사료,PSP 부산사료 햄스터 건강혼합사료 600g,1310,,,Mall: 네이버
햄스터 사료,[드길샵] 밀프로던트 850g 피그미다람쥐 사료 먹이 햄스터 소동물용,20000,,,Mall: 드래곤 길들이기 파충류샵
햄스터 톱밥,모모팜 슬림와일드 아스펜 베딩 1.2kg (중포장 30L) 쉐이빙 햄스터 톱밥,9800,모모팜,,Mall: 모모팜스토어
햄스터 톱밥,톱밥 참나무 매트용 베딩용 분갈이용 10kg,12800,,,Mall: 마트가멀어
햄스터 톱밥,"KJ 소나무베딩 14L 햄스터베딩,햄스터톱밥",1900,,,Mall: 햄스터몰
햄스터 톱밥,햄스터 베딩 종이베딩 YOOPET 10L 톱밥 대용,9500,,,Mall: 햄블리 HAMVELY
햄스터 톱밥,EA 소나무 대패 알 가루 톱밥 베딩 축사 양계장 대패밥,5100,,,Mall: 네이버
햄스터 톱밥,모모팜 아스펜믹스(정글) 베딩 1.4kg (중포장) 햄스터 톱밥,15200,모모팜,,Mall: 모모팜스토어
햄스터 톱밥,햄스터 베딩 톱밥 패러그린 슬림와일드 피그미다람쥐 베딩,13000,패러그린,,Mall: 햄블리 HAMVELY
햄스터 톱밥,패러그린 슬림와일드 아스펜베딩 1 2kg 소동물깔짚,10500,패러그린,,Mall: 네이버
햄스터 톱밥,대용량 편백 베딩 12L x 3개 토끼 햄스터 톱밥 바닥재,5930,,,Mall: 네이버
햄스터 톱밥,솜사탕 햄스터 종이베딩 햄스터 해동지 대용품,2000,,,Mall: 햄찌네 햄스터
햄스터 톱밥,햄스터 베딩 YOOPET 컬러풀 종이 베딩 10L,9500,,,Mall: 햄찌네 햄스터
햄스터 톱밥,모모팜 소프트 아스펜 베딩 2.0kg (중포장) 더스트프리 햄스터 톱밥,6900,모모팜,,Mall: 모모팜스토어
햄스터 톱밥,[패러그린] 패러그린 베딩 아스펜 믹스 - 포근 1.25kg,13800,패러그린,,Mall: 햄토피아
햄스터 톱밥,햄스터 베딩 패러그린 아스펜 슬림와일드,13000,패러그린,,Mall: 햄찌네 햄스터
햄스터 톱밥,[HASSY] 해씨 코코피트 300g / 햄스터 달팽이 파충류용 베딩,3980,,,Mall: 햄토피아
햄스터 톱밥,편백나무 사슴벌레 톱밥 고슴도치 햄스터 반려동물 앵무새 베딩 1kg,7500,,,Mall: 편백공작소
햄스터 톱밥,모모팜 더스트프리 프란 500g 아스펜 베딩 굴유지 디깅용 햄스터 톱밥,5700,모모팜,,Mall: 네이버
햄스터 톱밥,"모모팜 더스트프리(소프트) 500g 아스펜 베딩, 강력 먼지제거, 햄스터 톱밥",2500,모모팜,,Mall: 모모팜스토어
햄스터 톱밥,컬러 컷팅 햄스터해동지 / 자른 색동지/햄스터베딩,1200,,,Mall: 보라펫 햄스터
햄스터 톱밥,햄스터 해동지 100장 / 소동물 베딩,4900,,,Mall: 햄찌네 햄스터
햄스터 집,햄스터케이지 집 아크릴 골든케이지 대형단품60x38x48 피그미다람쥐사육장 소동물 고슴도치집 드워프,59800,,,Mall: 햄스메이트
햄스터 집,멍묘인 햄스터 집 케이지 원목 은신처 리빙박스 고슴도치,31250,,,Mall: 네이버
햄스터 집,[감성 끝판왕] 햄스터 집 케이지 카페 숨숨집 은신처 꾸미기,4900,집감성,,Mall: 집감성
햄스터 집,햄스터리빙박스 아크릴 골든 케이지 120 아크릴집 다람쥐,31000,,,Mall: 네이버
햄스터 집,지트펫 햄스터 케이지 중형 집 골든 아크릴 고슴도치 하우스,79000,,,Mall: 지트펫
햄스터 집,햄스터 집 케이지 골든 아크릴 대형 피그미다람쥐 사육장 고슴도치 용품,59800,,,Mall: 달토끼  방앗간
햄스터 집,"써르써르 2층집 햄스터 은신처 (다리 받침대 없음,엿보기 기와)",56000,,,Mall: 써르써르
햄스터 집,골든 햄스터 케이지 집 하우스 리빙박스 행햄케 세트,37000,,,Mall: 네이버
햄스터 집,미니펫 햄스터케이지 집 중형 골든 드워프 아크릴 고슴도치 피그미 용품,34900,,,Mall: 미니펫하우스
햄스터 집,120L 베이직 리빙하우스 / 햄스터 케이지 집/ 햄스터 리빙박스,43500,,,Mall: 햄토피아
햄스터 집,슈가글라이더 사육장 피그미다람쥐 케이지 하우스,33600,,,Mall: 네이버
햄스터 집,다람쥐사육장 아크릴 햄스터 케이지 2층집 풀세트,17630,,,Mall: 네이버
햄스터 집,햄스터 대형 케이지 아크릴 투명 고슴도치 집 사육장-화이트,40000,,,Mall: 네이버
햄스터 집,미니펫 3.0 renewal 햄스터케이지 집 100cm,119900,,,Mall: 미니펫하우스
햄스터 집,피그미다람쥐용품 골든햄스터케이지 80 아크릴리빙박스,28800,,,Mall: 네이버
햄스터 집,딴지트 햄스터케이지 대형 햄스터집 사육장 골든 피그미다람쥐 고슴도치,109000,,,Mall: 딴지트
햄스터 집,햄찌무드 원목 햄스터집 케이지 급수기 대형,75000,,,Mall: 네이버
햄스터 집,햄스터 케이지 다람쥐 사육장 집 대형 친칠라 고슴도치 디럭스 모델,17900,,,Mall: 네이버
햄스터 집,120L 디깅용 리빙하우스/햄스터 리빙박스,58000,아올로,,Mall: 보라펫 햄스터
햄스터 집,지트펫 햄스터 케이지 아크릴 집 하우스 골든 앞문열립,189000,,,Mall: 지트펫
햄스터 급식기,그늘집 우물 햄스터밥그릇 햄스터급식기,10800,,,Mall: 햄스터 그늘집
햄스터 급식기,나이트엔젤 햄스터밥그릇 햄스터급식기 원목그릇 와이드 그릇 L 1개,6500,,,Mall: 네이버
햄스터 급식기,미니애니맨 햄스터밥그릇 급식기 컴팩트식탁 2종,6500,,,Mall: 루루비 스토어
햄스터 급식기,타핏 햄스터밥그릇 햄스터급식기 컬러귀 그릇 1개,5100,,,Mall: 네이버
햄스터 급식기,미니애니맨 컴팩트 식탁 트윈 햄스터 급식기,6900,,,Mall: 네이버
햄스터 급식기,타핏 햄스터밥그릇 햄스터급식기 푸딩그릇 1개,9300,,,Mall: 네이버
햄스터 급식기,아크릴 자석 급식기 /햄스터 밥그릇 / 햄스터급식기,8000,,,Mall: 보라펫 햄스터
햄스터 급식기,FEED ME 도자기 급식기 소형 햄스터 급식기 밥그릇 사료통,3500,,,Mall: 햄찌네 햄스터
햄스터 급식기,햄테리어 원목 햄스터 식탁 / 햄스터 급식기 간식 밥그릇,8000,,,Mall: 햄찌네 햄스터
햄스터 급식기,큐티 세라믹 돔 급식기 / 햄스터 먹이 그릇 사료통 밥그릇,3000,,,Mall: 햄찌네 햄스터
햄스터 급식기,하트 모양 햄스터 급식기 / 햄스터 밥그릇 도자기 먹이그릇 사료통,6000,ALICE,,Mall: 햄찌네 햄스터
햄스터 급식기,타핏 햄스터밥그릇 햄스터급식기 선인장 그릇 14 딥 그린 1개,8000,,,Mall: 네이버
햄스터 급식기,과일모양 세라믹 햄스터 급식기,4000,,,Mall: 햄스터몰
햄스터 급식기,돔형 급식기 핑크,2500,,,Mall: 햄토피아
햄스터 급식기,햄스터 급식기 / 파스텔 슬림 곰돌이 식판 간식그릇 트레이 이유식 접시,1200,,,Mall: 햄찌네 햄스터
햄스터 급식기,미우펀 햄스터밥그릇 햄스터자동급식기 선인장 그릇 11 라이트 1개,6900,,,Mall: 네이버
햄스터 급식기,그늘집 햄스터밥그릇 급식기,6800,,,Mall: 햄스터 그늘집
햄스터 급식기,햄스터 급식기 나루토마키 어묵 모양 밥그릇,9000,,,Mall: 햄찌네 햄스터
햄스터 급식기,당근 모양 도자기 햄스터 급식기 / 햄스터 밥그릇 먹이 사료통,6000,ALICE,,Mall: 햄찌네 햄스터
햄스터 급식기,북유럽 도자기 식기/햄스터식기/햄스터급식기,2000,,,Mall: 보라펫 햄스터
물고기 사료,테트라 비트 300ml 구피 디스커스 먹이 물고기 베타 금붕어 열대어 밥,6390,테트라,,Mall: 라라아쿠아-
물고기 사료,[갓성비]다시봄 150큐브 냉동 브라인쉬림프 안시 구피 열대어먹이 치어사료 브라인 슈림프 냉브,9900,,,Mall: 다시. 봄
물고기 사료,테트라 구피 푸드 100 열대어 구피 물고기 사료 밥 먹이,3000,테트라,,Mall: 시스펫
물고기 사료,레인보우 감마루스 1000ml 거북이먹이 사료 밥 건조새우,7900,,,Mall: 아마존피쉬앤플랜츠
물고기 사료,프리미엄 물고기사료 2.5kg 금붕어 비단잉어 잉어 붕어 메기 향어 부상사료 물고기밥,10900,,,Mall: 네이멀
물고기 사료,물멍 냉동 브라인쉬림프 알약형 150알,14500,물멍,,Mall: 물멍몰
물고기 사료,그로비타 구피 사료 50g 100ml,4360,,,Mall: 네이버
물고기 사료,그로비타 베타사료 50g 100ml,4000,,,Mall: 네이버
물고기 사료,히카리 플레코사료 82g 안시 플레코먹이,4530,히카리,,Mall: 네이버
물고기 사료,그로비타 침강성 금붕어사료 130g 250ml,6200,,,Mall: 네이버
물고기 사료,그로비타 프리미엄 사료 구피 100ml 물고기 밥 열대어 먹이,5500,,,Mall: 쿠아쿠아
물고기 사료,아쿠아시스템 그린달웜,7000,기프트앤돌,,Mall: 주식회사 기프트앤돌
물고기 사료,그로비타 플레코 사료 115g,6000,,,Mall: 네이버
물고기 사료,냉동 브라인쉬림프 [알약형] 150알 / 브라인슈림프,12000,물멍,,Mall: 물멍mall
물고기 사료,사키 히카리 팬시 골드피쉬 200g 육성용 금붕어 난주 오란다 특화 사료 침강성,15000,,,Mall: 은도끼
물고기 사료,중형 물고기 열대어 전용사료 130g 먹이공급,9000,,,Mall: 네이버
물고기 사료,그로비타 탈각알테미아 50g 100ml,4750,,,Mall: 네이버
물고기 사료,브라인쉬림프에그 열대어먹이 구피치어밥 생브 사료 인베셉아트 30ml(약 15g),6000,,,Mall: 라라아쿠아-
물고기 사료,그로비타 구피전용 사료 130g/250ml,7490,,,Mall: 라라아쿠아-
물고기 사료,JUN NEW 프리미엄 크릴 그래뉼 파퍼 20g 물고기사료 준,18650,,,Mall: 네이버
물고기 어항,안깨지는 세이프티어항 거북이 물고기 열대어 금붕어 구피 키우기 아크릴 수족관 중형 화이트,25860,페이토,,Mall: 물고기입니다만
물고기 어항,어항 스폰지밥 구피 미니 작은 어항세트 물고기키우기 열대어 새우 가재 미니 수족관,17900,아마존,,Mall: 지성이네아쿠아
물고기 어항,안깨지는어항 거북이 구피 열대어 아크릴 수족관 금붕어 키우기 물고기 수조 중형 화이트,24900,,,Mall: 리비아쿠아
물고기 어항,무환수 구피 베타 물고기 키우기 미니 자동청소어항 20하이큐브 세트 원스팜,97500,,,Mall: 테이블펫
물고기 어항,어항 소형 베타 구피 물고기 새우 키우기 미니 어항세트 수족관 선택형 가습 20큐브 25큐브 30큐브 디아망 수조,20000,,,Mall: 루미앤홈
물고기 어항,안깨지는 3세대 어항 거북이 물고기 열대어 금붕어 구피 키우기 아크릴 수족관 소형 화이트,24900,,,Mall: 차쿠아리움
물고기 어항,베타 어항 꽃침대 3L 플라스틱 미니어항세트 물고기 베타키우기,12900,,,Mall: 리비아쿠아
물고기 어항,"45cm무환수 무여과 올디아망어항 뚜껑포함(수초키우기, 구피어항세트, 물고기키우기)",89000,,,Mall: 와이이아쿠아
물고기 어항,칸후 45슬림 올디아망 어항 5T 자반 수조 구피 우레탄매트,12900,,,Mall: 네이버
물고기 어항,토토로 어항 풀세트 베타 구피 미니 어항세트 물고기키우기 열대어 수족관 숲속의 토토로,61800,,,Mall: 차쿠아리움
물고기 어항,무환수 자동청소 수초 구피 베타 물고기 키우기 어항제외 재료세트 원스팜,59500,,,Mall: 테이블펫
물고기 어항,베타어항 미니어항세트 3L 아크릴 수족관 물고기 구피 열대어 키우기,15900,,,Mall: 리비아쿠아
물고기 어항,엔젤피쉬 열대어 거북이 키우기 2자 3자 광폭 축양장 받침,45130,,,Mall: 네이버
물고기 어항,모모탱크 M-220 에디션 실버 일체형 미니 어항 섬프 세트 베타 구피 물고기 키우기 수조 가정용 수족관,33500,모비딕,,Mall: 주식회사 모비딕
물고기 어항,자동환수 베타 어항 열대어 수족관 구피 물고기 키우기 자동청소 기본 미니어항 세트,12900,,,Mall: 리비아쿠아
물고기 어항,젠카 마리모 어항 베타 구피 새우 키우기 물멍 작은 물고기 치어 미니 블럭 수조,1790,,,Mall: 네이버
물고기 어항,무환수 자동청소 수초어항 베타 물고기 키우기 15하이큐브 세트 원스팜,79300,,,Mall: 테이블펫
물고기 어항,모비딕 어항 펭귄가족 물고기키우기 가정용 수족관 구피 열대어 어항세트 MC-36,52140,모비딕,,Mall: 네이버
물고기 어항,"60cm무환수 무여과 올디아망어항 뚜껑포함(수초키우기, 구피어항세트, 물고기키우기)",119000,,,Mall: 와이이아쿠아
물고기 어항,원형어항 둥근 어항 유리 관상용 물고기 금붕어 그릇소형,9510,,,Mall: 네이버
물고기 어항꾸미기,베타침대 1+1 플라워 은신처 물고기 어항꾸미기 베타꽃침대,7500,,,Mall: 리비아쿠아
물고기 어항꾸미기,어항꾸미기 물고기 베타 침대 은신처 세라믹 S 구피 놀이터 어항장식,4900,,,Mall: 리비아쿠아
물고기 어항꾸미기,베타 꽃침대 플라워 은신처 베타침대 어항꾸미기,3000,칸후,,Mall: 다온아쿠아
물고기 어항꾸미기,장식 풍성한 물고기 어항꾸미기 열대어 은신처 인조 수초 WFJ1DX8,4100,,,Mall: 네이버
물고기 어항꾸미기,어항꾸미기 장식 스폰지밥 파인애플집 구피 베타 새우 물고기 열대어 수족관 은신처,2300,,,Mall: SmileBaby
물고기 어항꾸미기,유리성 어항 장식품 네온테트라 체리새우 금붕어 키우기 어항꾸미기 예쁜,4500,,,Mall: 안녕물고기
물고기 어항꾸미기,어항 꾸미기 물고기 새우 놀이터 은신처 구피 베타,580,,,Mall: 네이버
물고기 어항꾸미기,버블 하우스 유리구 물고기집 수족관 어항 꾸미기 꽃침대 유리볼 베타침대,3500,,,Mall: 안녕물고기
물고기 어항꾸미기,칸후 LS-S5 실크조화 5종세트 어항꾸미기 물고기 구피 은신처 장식품,5000,칸후,,Mall: 안녕물고기
물고기 어항꾸미기,장식 풍성한 물고기 어항꾸미기 열대어 은신처 인조 수초 WFJ1DXB,4270,,,Mall: 네이버
물고기 어항꾸미기,니모 구피 금붕어 실리콘 가짜물고기 어항꾸미기 F01 신선어,10100,,,Mall: 네이버
물고기 어항꾸미기,칸후 술통장식 어항장식품 어항꾸미기 물고기 구피 은신처 수족관 놀이터 꾸미기,3400,칸후,,Mall: 안녕물고기
물고기 어항꾸미기,물고기 어항꾸미기 꽃게 구피 자라 거북이 캐릭터장식 본상품선택 1개,1390,,,Mall: 네이버
물고기 어항꾸미기,인공수초 가정용 인조 수초 장식 물고기 어항 꾸미기 구피 치어 은신처,5690,,,Mall: 네이버
물고기 어항꾸미기,구피치어 관상어 산란실 코너 새우 물고기 어항 꾸미기 치어,8530,,,Mall: 네이버
물고기 어항꾸미기,도토 물고기 어항꾸미기 빈티지 데코 성장식 수족관 바닥,11070,,,Mall: 네이버
물고기 어항꾸미기,은신처 놀이터 장식 구피 물고기 어항꾸미기 E16WB0CEE0,3970,,,Mall: 네이버
물고기 어항꾸미기,은신처 3단 놀이터 물고기 어항꾸미기 장식 구피 M1WB713607,11430,,,Mall: 네이버
물고기 어항꾸미기,소형사이즈 물고기 은신처 어항꾸미기,3000,,,Mall: 네이버
물고기 어항꾸미기,수족관 소라게 물고기 어항 꾸미기 은신처 장식용 목재 장식 다공성 새우 유목 수조 천연,10400,,,Mall: 네이버
새 사료,PSP 앵무새 전용먹이 앵무새모이 앵무새사료 새사료,2140,,,Mall: 네이버
새 사료,애완조류 펫간식 소형새 전용사료 600g 새모이 사료,1800,,,Mall: 네이버
새 사료,산란용 농협 닭사료 청계 오골계 오리 퍼펙트 산란 20kg 닭 새 모이 알잘낳는 가루사료,12000,씨에이코리아,,Mall: 조은세상1
새 사료,앵무새 먹이 이탈리아산 마니토바 왕관모란1kg 새 사료 모이 밥용품 간식 펠렛,6900,,,Mall: 리프패럿
새 사료,앵무새 먹이 리오 왕관 모란 새 사료 모이 용품 펠렛 밥 간식 코뉴어 퀘이커,9600,,,Mall: 리프패럿
새 사료,앵무새먹이 비타폴 자연주의 비타라인 컴플리트 코뉴어 퀘이커 2.2kg 새 사료 모이 용품,43500,,,Mall: 리프패럿
새 사료,하선사료 코뉴어 새먹이 새모이 앵무새 사료 먹이 중소형용 500g,9500,,,Mall: 하선사료
새 사료,PSP PSP 천연영양 새사료/새모이/새먹이 앵무새 모란 문조 (유통기한 보장),2210,,,Mall: 옥션
새 사료,앵무새 먹이 버셀라가 프리스티지 새 사료 모이 펠렛 밥 간식 용품 잉꼬 사랑앵무 모란 왕관 코뉴어 퀘이커,7900,,,Mall: 리프패럿
새 사료,앵무새 영양보충 필수 보양식 앵짱 500g 새간식 먹이 모이 모든 앵무새사료,11500,,,Mall: 네이버
새 사료,하선사료 모란앵무 소형앵무 새먹이 새모이,8500,,,Mall: 하선사료
새 사료,한일 산란 닭사료 20kg 산란닭 닭모이 먹이 왕,11500,,,Mall: 한양사료유통
새 사료,하선사료 사랑앵무 새먹이 새모이,7900,,,Mall: 하선사료
새 사료,앵무새 생식 자연주의 동결건조 과채동 새 사료 먹이 모이 용품 간식 모란 왕관 코뉴어 퀘이커,7900,리프패럿,,Mall: 리프패럿
새 사료,조류사료 PSP 천연영양 새사료 1팩 600g,1950,,,Mall: 네이버
새 사료,앵무새먹이 리오 왕관 모란 코뉴어 1kg 새 모이 밥 용품 간식,9600,,,Mall: 리프패럿
새 사료,앵무새 사료 탑스오가닉 유기농 미니 펠렛 중소형 453g 먹이,13170,,,Mall: 네이버
새 사료,앵무새 펠렛 프리티버드 데일리 셀렉트 미니 350g 앵무새 과일 간식 사료 새 먹이,9600,,,Mall: 앵무새 장난감 애니버드샵
새 사료,뉴트리나 컨츄리꼬꼬 산란계 크럼블 20kg 산란 닭사료 닭모이,11990,뉴트리나,,Mall: 남양펫푸드
새 사료,리아펫 잉꼬 핀치 앵무새 먹이 600g 새 사료 모이 밥,1920,,,Mall: 네이버
새 집,야외 새집 새장 나무 새둥지 기둥걸이 원목 내추럴 꾸미기 정원,12460,,,Mall: 네이버
새 집,미가데코 새집 (먹이집) 소나무 새집만들기 반제품,13000,,,Mall: 나무냉장고
새 집,수제 원목새장 야외 새집 새 키우기 둥지 나무집 대형,7840,,,Mall: 네이버
새 집,앵무새 새장 대형 안전한 날림장 760 새장 횃대 포함 새집 앵무새장 새 용품,43650,,,Mall: 앵무새 장난감 애니버드샵
새 집,러블리썬 새둥지 새집 나무 야외 둥지 정원 텃밭 케이지,13500,,,Mall: 네이버
새 집,앵무새 알통 새집 둥지 서랍 코뉴어 신형 은신처 원목 중형 대형 모란 좌측,12290,,,Mall: 네이버
새 집,야외 새둥지 나무 새집 1개 마당 걸이형 인테리어,13000,,,Mall: 네이버
새 집,렉산새장 아크릴 대두박 앵무새용 날림장 실내 새장 새집,62900,,,Mall: 네이버
새 집,앵무새 새장 안전한 날림장 600 새장 4 colors 파스텔 컬러 새집 앵무새 용품,28990,,,Mall: 앵무새 장난감 애니버드샵
새 집,야외 새집 새장 원목 꾸미기 새둥지 정원 기둥걸이 나무 불타는 색 꼭대기 걸이 나무,17640,,,Mall: 네이버
새 집,앵무새 놀이터 횟대 농장 새장 장난감 새집 키우기,21000,,,Mall: 네이버
새 집,앵무새놀이터 2층앵무새집 날림장선반 대형새장 A06 클래식 패키지 1업그레이드 L 대형,31680,,,Mall: 네이버
새 집,앵무새 새장 사각라운드 그네 1단 2단 새장 횃대 날림장 앵무새장 새집,38000,,,Mall: 네이버
새 집,새장 대형 아크릴 앵무새 놀이터 케이지 새집,47900,,,Mall: 네이버
새 집,야외 인공새집 새둥지 원목 새장 은신처 보금자리,80600,,,Mall: 네이버
새 집,앵무새장 대형 사육장 새장 새집 이동식 놀이터,36840,,,Mall: 네이버
새 집,투명 앵무새장 앵무새 날림장 투명 새집 대형,57810,,,Mall: 네이버
새 집,새집 스탠드 새 기둥 마당 나무 조경 인테리어 스네일 플러그인,20340,,,Mall: 네이버
새 집,앵무새 새장 대형 놀이터 하우스 새집 이동식 사육장 B타입 기본 초대형,38600,,,Mall: 네이버
새 집,앵무새 대형 새장 거치대 앵무새장 새집 1 스탠드 소형 투명 큐 새놀이터 받침대,18430,,,Mall: 네이버
새 급식기,앵무새 자동 급식기 새 조류 모이통 먹이 상자 급여기 D,9100,,,Mall: 네이버
새 급식기,자동급식기 새 먹이 공급기 반려 이동식 동물 플라스틱 용기 425g 걸이 낮은 서랍장 버전,11860,,,Mall: 네이버
새 급식기,앵무새 자동 급식기 새 조류 모이통 먹이 상자 급여기 D,9160,,,Mall: 네이버
새 급식기,"새 자동 급식기 1개, 새장용 방수 아크릴 투명 급식 상자, 작은 중간 앵무새 음식 컵용 새 급식 용기",26202,,,Mall: TEMU kr
새 급식기,모바일 폰 원격 지능형 타이밍 자동 급식기 새 급식기 거북이 금붕어 어항 급식기,29000,,,Mall: 11번가
새 급식기,급수기 새모이 모이 급식기 자동급식기 통,2570,,,Mall: 네이버
새 급식기,옥외용 급식기 새먹이통 대용량 정원 인테리어 조류 걸이형 새 급식기 방수 디자인 대용량,26700,,,Mall: 브로스픽
새 급식기,애완 동물 새 플라스틱 자동 급식기 앵무새 칵테일 물 마시는 사람 컵 그릇 디펜서 케이지,7700,,,Mall: 네이버
새 급식기,새모이통 급식기 앵무새 급여기 앵무 먹이통 밥그릇 화이트-더블,28400,,,Mall: 네이버
새 급식기,새모이통 급수대 급식기 피더 조류용품,410,,,Mall: 네이버
새 급식기,급수기 새모이 모이 급식기 자동급식기 통,2660,,,Mall: 네이버
새 급식기,급식기 새 애완 동물 자동 먹이 공급기 물튀김 방지 케이지 액세서리,14460,,,Mall: 네이버
새 급식기,자동급식기 새 스테인레스 장난감 음료 스윙 씹기 피더 먹이 분리형 나무,16210,,,Mall: 네이버
새 급식기,꽃 모양 반려동물자동급식기 새 먹이 쟁반 해바라기 조류 야외 피더 정원 장식 말뚝,22940,,,Mall: 네이버
새 급식기,1pc 애완 조류 급식기 꿀벌 공급품 야생 조류 급식기 작은 매달린 급식 도구 새들을 위해,3468,,,Mall: TEMU kr
새 급식기,먹이 플라스틱 동물 자동급식기 새 반려 이동식 용기 공급기 425g 걸이 낮은 서랍장 버전,17200,,,Mall: 네이버
새 급식기,자동 닭사료통 타이머 사료 닭 피더 모이 새 반포용 30L 스테인리스 모델,66500,,,Mall: 네이버
새 급식기,다람쥐 방지 강아지자동급식기 새 먹이 주기 야외 장식 자동 벌새 행잉 급수,19380,,,Mall: 네이버
새 급식기,옥외용 급식기 새먹이통 대용량 트레이 1 안뜰 병아리 마시는 축산업 스티커 1장,25900,,,Mall: 네이버
새 급식기,모바일 폰 원격 지능형 타이밍 자동 급식기 새 급식기 거북이 금붕어 어항 급식기,19750,,,Mall: aliexpress
토끼 사료,리뉴얼 이스타 토끼 사료 헤어볼 장케어 900g 1개,14000,,,Mall: 네이버
토끼 사료,토끼 전용사료 대용량 큰토끼 키우기 펠렛 기니피그 사료,23900,,,Mall: 네이버
토끼 사료,동물 큰 토끼 전용 과일 채소 사료 밥 먹이 750g,2150,,,Mall: 네이버
토끼 사료,대용량 건초 알파파 알팔파 기니피그 토끼 친질라 염소 먹이 밥 수입 티모시 A 9kg,24900,,,Mall: 열방
토끼 사료,손질 알팔파 건초 토끼 사료 먹이 미국산 500g 1kg,3000,,,Mall: 헤헤사료
