Category,Name,Price,Brand,Description,Product_Info
토끼 사료,티모시 1kg 3+1 건초 토끼 먹이 벅스매니아,4000,,,Mall: 벅스매니아
토끼 사료,슈프림펫 셀렉티브 시니어 토끼사료 2kg,19800,,,Mall: 네이버
토끼 사료,에밀리펫 손질완료 티모시건초1kg 토끼먹이 사료 기니피그 친칠라,7300,에밀리펫,,Mall: 작은 친구들
토끼 사료,제네시스 티모시 토끼사료1kg,11000,,,Mall: 작은 친구들
토끼 사료,제네시스 토끼 사료 티모시건초 먹이 5kg,40000,,,Mall: 옥스보우점케이알
토끼 사료,"라핀하우스 미국산 1번 티모시 토끼먹이, 토끼사료, 토끼건초 ,토끼티모시",4900,,,Mall: 라핀테이블
토끼 사료,채릇채릇 손질 건초 500g 토끼 기니피그 친칠라,4500,,,Mall: 채릇채릇
토끼 사료,조이스틱 토끼사료 730g 큰토끼용 먹이 밥,1800,,,Mall: 펫하우스
토끼 사료,손질 연맥 건초 토끼 사료 먹이 호주산 500g 1kg,3000,,,Mall: 헤헤사료
토끼 사료,"라핀하우스 캐나다산 티모시 토끼먹이 토끼사료 토끼건초,토끼티모시",4900,,,Mall: 라핀테이블
토끼 사료,손질 티모시 건초 캐나다산 1번초 500g 1kg,3000,,,Mall: 헤헤사료
토끼 사료,에밀리펫 손질완료 약용 혼합건초 1kg 토끼먹이 사료 기니피그 친칠라,8300,에밀리펫,,Mall: 작은 친구들
토끼 사료,헤이랜드 손질 티모시 건초 1번초 토끼 먹이 SP 500g,4500,,,Mall: 헤이 랜드
토끼 사료,제네시스 알파파 토끼사료 1kg,11000,,,Mall: 옥스보우점케이알
토끼 사료,제이펫 슈프림 셀렉티브 친칠라 사료 1개 2kg,19800,,,Mall: 네이버
토끼 집,펫초이스 토끼 집 하우스 케이지 사육장,990,펫초이스,,Mall: 펫초이스
토끼 집,토끼장 대형 투명 토끼 케이지 기니피그 사육장 하우스 실내 서랍 화장실,48050,,,Mall: 네이버
토끼 집,토끼장 이동식 사육장 스틸 토끼집 특대형 철장,36230,,,Mall: 네이버
토끼 집,토끼사육장 가정용토끼집 대형 토끼장 은신처 가정용 실내 대형,112390,,,Mall: 네이버
토끼 집,대형 토끼장 특대형 분뇨방지 토끼집 닭장 집 조립식,25770,,,Mall: 네이버
토끼 집,토끼 케이지 사육장 하우스 토끼집 토끼장 대형 애완동물-옵션01,40820,,,Mall: 네이버
토끼 집,대형토끼집 토끼케 토끼장 하우스 애완,27930,,,Mall: 네이버
토끼 집,토끼 은신처 우리 친칠라 토끼장 토끼집 사육장 기니피그 실내,75050,,,Mall: 네이버
토끼 집,"라핀하우스 미국산 1번 티모시 토끼먹이, 토끼사료, 토끼건초 ,토끼티모시",4900,,,Mall: 라핀테이블
토끼 집,조이스틱 토끼사료 730g 큰토끼용 먹이 밥,1800,,,Mall: 펫하우스
토끼 집,토끼장 닭장 농가 가축 마당 야외 토끼집 사육,133200,,,Mall: 네이버
토끼 집,온토 건식 토끼배변판 비절병 방지 화장실,24000,,,Mall: 온토 onto
토끼 집,"라핀하우스 캐나다산 티모시 토끼먹이 토끼사료 토끼건초,토끼티모시",4900,,,Mall: 라핀테이블
토끼 집,토끼 케이지 애완용 하우스 기니피그 우리 애완용 사육장,19080,,,Mall: 네이버
토끼 집,"토끼집 은신처 겸용 매트, 먹어도 안심 티모시건초 기니피그 친칠라",16800,에밀리펫,,Mall: 작은 친구들
토끼 집,토끼은신처 바나나오두막 자연소재 토끼집,19800,,,Mall: 작은 친구들
토끼 집,기니피그 케 토끼집 토끼장 애완용 소형견 운반 하우스 블랙35x26x30cm휴대용,17300,,,Mall: 네이버
토끼 집,대형 토끼장 특대형 집 케이지 소호 토끼집 토끼 사육장,20300,,,Mall: 네이버
토끼 집,대형 토끼장 특대형 조립식 닭장 토끼집 사육장 반밀폐형 분뇨방지 야외 집,27600,,,Mall: 네이버
토끼 집,토끼장 우리 사육장 토끼집 토끼 애완동물 케이지 가정용 기니치그 하우스,49370,,,Mall: 네이버
토끼 급식기,보드미 소동물용 토끼 급식기 1P 반자동 급여 밥그릇 세트 그릇,7000,보드미,,Mall: 네이버
토끼 급식기,강아지키우기 자동지급기 고양이용 행잉 디펜서 개용 자동 급수기 토끼 급식기 애견급식기,27290,,,Mall: 네이버
토끼 급식기,강아지키우기 자동지급기 고양이용 행잉 디펜서 개용 자동 급수기 토끼 급식기 애견급식기,26370,,,Mall: 네이버
토끼 급식기,강아지키우기 고양이용 행잉 디펜서 개용 자동 급수기 토끼 급식기 애견급식기,17770,,,Mall: 네이버
토끼 급식기,e esscopro 토끼 급식기 세트 급수기 3개 및 건초,45360,,,Mall: 파랑17초록
토끼 급식기,강아지키우기 자동지급기 고양이용 행잉 디펜서 개용 자동 급수기 토끼 급식기 애견급식기 A,30400,,,Mall: 해외구매대행몰 열번째이야기
토끼 급식기,우미펫 안티블랙턱 토끼 급식기,8920,,,Mall: G마켓
토끼 급식기,"1.2L 대용량 매달이형 애완동물 급식기 및 물통, 토끼, 고양이, 개 등 다양한 반려동물에 적합",6996,,,Mall: TEMU kr
토끼 급식기,별동샤인 워터키트 급수기 블루 토끼급식기 애견급수대,40940,,,Mall: 11번가
토끼 급식기,토끼 급식기 반자동 밥그릇 1P 사료 그릇 먹이 통 애완동물 식기 수조 식사 용기 설정,20710,,,Mall: 그로브펫
토끼 급식기,슈디넬 반자동급수 스텐 물병식기 소 그린 개밥그릇 강아지물병식기 토끼급식기,8400,,,Mall: 찌르메스
토끼 급식기,티모시 사료통 건초통 A 화장실 실내용 기니피그 토끼 급식기,20400,,,Mall: 톡톡핫딜
토끼 급식기,파라제이 4B 반자동급수 스텐 식기 소 826 그린 토끼급식기 애견급수대 기니피그밥통,8580,,,Mall: 파라제이
토끼 급식기,소동물용 토끼 급식기 1P 반자동 급여 밥그릇 세트,26200,,,Mall: G마켓
토끼 급식기,소동물용 토끼 급식기 1P 반자동 급여 밥그릇 세트,26200,,,Mall: 옥션
토끼 급식기,소동물용 토끼 급식기 1P 반자동 급여 밥그릇 반자동급식기 세트,18100,보드미,,Mall: 나홍플러스
토끼 급식기,토끼 급식기 사료 건초 그릇 스몰펫용품 소동물 간식 먹이,17140,,,Mall: 11번가
토끼 급식기,토끼 급식기 사료 건초 그릇 스몰펫용품 소동물 간식 먹이,17140,,,Mall: G마켓
토끼 급식기,토끼 급식기 사료 건초 그릇 스몰펫용품 소동물 간식 먹이,17140,,,Mall: 옥션
토끼 급식기,토끼 급식기 소형 동물 급여기 금속 사료통 미니 사료기,12400,,,Mall: 11번가
파충류 사료,녹십자 크레스티드게코 슈퍼푸드 크레 먹이 사료 지렙 무화과 50g,12000,,,Mall: 파충류샵 정글펫
파충류 사료,게코뉴트리션 하이인섹트 500G 도마뱀 사료 크레 먹이 파충류 슈퍼푸드 크레스티드게코 가고일게코 리키에너스,17000,,,Mall: 네이버
파충류 사료,게코 뉴트리션 크레스티드게코 슈퍼푸드 사료 먹이 바나나 50g,17000,,,Mall: 파충류샵 정글펫
파충류 사료,피딩용 무침 주사기 크레스티드게코 파충류 도마뱀 용품 피딩 핸드피딩 크레 게코 먹이 사료,250,두렙,,Mall: 두렙 DooRep
파충류 사료,녹십자수의약품 크레 슈퍼푸드 지렙 인섹트 도마뱀 사료 G-REP INSECT 50g,12000,,,Mall: 파충류샵 드래곤브리딩센터
파충류 사료,판게아 브리딩포뮬러 228g(8oz) 크레 슈퍼푸드 도마뱀먹이 파충류사료 크레스티드게코,38000,,,Mall: 오늘도마뱀 고양
파충류 사료,[한방애 렙타일] 레오파드게코 레게조아 인섹트 츄르 도마뱀 슈퍼푸드 즉석 파충류 사료,24000,,,Mall: 벅스브라더스
파충류 사료,판게아 브리딩포뮬러 56g(2oz) 크레 슈퍼푸드 도마뱀먹이 파충류사료 크레스티드게코,17000,,,Mall: 오늘도마뱀 고양
파충류 사료,레파시 슈퍼푸드 그럽앤후르츠 170g 프룻 크레스티드게코 사료 파충류 먹이,32000,,,Mall: 디노펫
파충류 사료,지렙 슈퍼푸드 대용량 인섹트 1.8kg 지랩 크레 파충류 게코 비어디 사료 밥 먹이,176000,,,Mall: 준이네 아쿠아
파충류 사료,100g 녹십자 G-REP 슈퍼푸드 도마뱀 사료 파충류 크레 크레스티드게코 지렙 무화과,22000,,,Mall: 네이버
파충류 사료,레파시 슈퍼푸드 그럽앤후르츠 85g 프룻크레스티드게코 사료 파충류 먹이,18500,,,Mall: 디노펫
파충류 사료,마주리 육지거북 사료 거북이 LS 다이어트 200g,11000,마주리,,Mall: 파충류샵 정글펫
파충류 사료,200G JIF 팩맨 푸드 팩맨 픽시프록 토드류 살라만다 양서류 개구리 사료 먹이,18500,,,Mall: 파충류샵 뉴런렙스타
파충류 사료,히카리 드래곤겔 60g 비어디드래곤 도마뱀 전용 슈퍼푸드사료 파충류용품 먹이,11500,히카리,,Mall: 네이버
파충류 사료,JIF 팩맨푸드50g 양서류 사료 먹이,5500,,,Mall: 파충류샵 뉴런렙스타
파충류 사료,바이탈밀 인섹트 50g 크레 슈푸 도마뱀 슈퍼푸드 크레스티드게코 사료 1개,10000,,,Mall: 네이버
파충류 사료,바이탈밀 슈퍼그린 50g 누에 분말 슈퍼푸드 크레 파충류 게코 비어디 사료 밥 먹이,15000,,,Mall: 준이네 아쿠아
파충류 사료,녹십자 크레 슈퍼푸드 지렙 인섹트 도마뱀 사료 지랩 G-REP INSECT 100g,22000,,,Mall: 리치맨 파충류 샵
파충류 사료,녹십자수의약품 크레 슈퍼푸드 지렙 인섹트 도마뱀 사료 G-REP INSECT 100g,22000,,,Mall: 파충류샵 드래곤브리딩센터
파충류 집,레파즈 적재형 케이지 (대) 크레스티드게코 도마뱀 파충류 사육장 도마뱀집 몸통만,7000,,,Mall: 게코몽
파충류 집,엑소테라 유리사육장 303045 cm 크레스티드게코 사육장,103000,,,Mall: 파충류샵 정글펫
파충류 집,렉사육장 자동온도 조절 파충류 도마뱀 레오파드게코 뱀 렉사 사육장 1층,85000,,,Mall: 파충류샵 정글펫
파충류 집,타이거렉 센티페드 / 자이언트지네 아시안포레스트 애완용거미 타란튤라,12000,,,Mall: 파충류사육장 온라인스토어
파충류 집,이슬라 마르가리타 25cm+- / 블랙기간테아 기간티아 자이언트지네 왕지네,1200000,,,Mall: 파충류사육장 온라인스토어
파충류 집,크레스티드게코 도마뱀 사육장 바닥재 소형 펠트지 크레 파충류,2000,,,Mall: 파충류샵 반모리
파충류 집,두렙 어메이징패드 소형 (120매) 크레스티드게코 게코 바닥재 도마뱀 파충류 키우기 사육장,4100,두렙,,Mall: 두렙 DooRep
파충류 집,엑소테라 303045테라리움 파충류 크레사육장,103000,,,Mall: 뉴런렙타일
파충류 집,레오파드게코사육장 도마뱀 파충류 아크릴 온도조절 사육장,37530,,,Mall: 네이버
파충류 집,육지거북이사육장 자동온도조절 도마뱀 파충류 PB사육장,97000,,,Mall: 토라사육장
파충류 집,정글펫 렉사육장 J 3호 터브,10000,,,Mall: 파충류샵 정글펫
파충류 집,정글펫 렉사육장 J 1호 터브,3500,,,Mall: 파충류샵 정글펫
파충류 집,정글펫 렉사육장 J 2호 터브,4500,,,Mall: 파충류샵 정글펫
파충류 집,엑소테라 유리사육장 백스크린 비바리움 테라보드 조각20x30cm 2.5cm,4900,,,Mall: 파충류샵 정글펫
파충류 집,아시안 포레스트 준성체 / 전갈 타란튤라 새잡이거미 애완거미 극동전갈 곤충,13000,,,Mall: 파충류사육장 온라인스토어
파충류 집,에코브릿지 파충류 도마뱀사육장 20x20x30 매립형 크레스티드게코 크레,120000,에코브릿지,,Mall: 파충류샵 디어렙
파충류 집,골드 기간테아 준성체 / 기간티아 자이언트 센티페드 대왕지네 타란튤라 애완곤충,1100000,,,Mall: 파충류사육장 온라인스토어
파충류 집,페이토 안깨지는 청소 편리한 도마뱀 사육장 파충류 하우스 집,52360,페이토,,Mall: 네이버
파충류 집,조이렙타일 조이클린케이지 대 투명 크레스티드게코 사육장 파충류 사육장 도마뱀집 1개 연보라,22000,조이렙타일,,Mall: 네이버
파충류 집,파충류 하우스 자동온도조절 육지 육지거북이사육장,24520,,,Mall: 네이버
